{
  "name": "fortios_certificate_rotation",
  "dialect": "fortios",
  "intended": "config vpn certificate local\n    edit \"Fortinet_CA\"\n        set private-key \"-----BEGIN ENCRYPTED PRIVATE KEY-----\nMIIFDjBABgkqhkiG9w0BBQ0wMzAbBgkq\nhkiG9w0BBQwwDgQIabcd+/EFGH==\n-----END ENCRYPTED PRIVATE KEY-----\"\n        set range global\n    next\nend\nconfig firewall policy\n    edit 1\n        set srcintf \"port1\"\n        set dstintf \"port2\"\n        set action accept\n    next\nend\n",
  "actual": "config vpn certificate local\n    edit \"Fortinet_CA\"\n        set private-key \"-----BEGIN ENCRYPTED PRIVATE KEY-----\nMIIFDjBABgkqhkiG9w0BBQ0wMzAbBgkq\nhkiG9w0BBQwwDgQIabcd+/EFGH==\nQklTM1RyYWlsaW5nQmxvY2s9PQ==\n-----END ENCRYPTED PRIVATE KEY-----\"\n        set range global\n    next\nend\nconfig firewall policy\n    edit 1\n        set srcintf \"port1\"\n        set dstintf \"port2\"\n        set action accept\n    next\nend\n",
  "normalization_steps": [],
  "order_policy": {
    "default": "keyed-stable",
    "overrides": []
  },
  "expected": {
    "has_changes": true,
    "edit_types": ["Insert"],
    "finding_codes": []
  }
}
