{
  "name": "parse_uncertainty",
  "intended": "  orphan-line\n",
  "actual": "  orphan-line\n",
  "normalization_steps": [],
  "order_policy": {
    "default": "ordered",
    "overrides": []
  },
  "expected": {
    "has_changes": false,
    "edit_types": [],
    "finding_codes": [
      "unknown_unparsed_construct",
      "unknown_unparsed_construct"
    ]
  }
}
