{
  "name": "root_reorder_unordered",
  "intended": "hostname edge-1\nip domain-name example.com\n",
  "actual": "ip domain-name example.com\nhostname edge-1\n",
  "normalization_steps": [],
  "order_policy": {
    "default": "unordered",
    "overrides": []
  },
  "expected": {
    "has_changes": false,
    "edit_types": [],
    "finding_codes": []
  }
}
