{
  "name": "root_reorder_unordered_with_change",
  "intended": "hostname edge-1\nip domain-name example.com\n",
  "actual": "ip domain-name example.com\nhostname edge-2\n",
  "normalization_steps": [],
  "order_policy": {
    "default": "unordered",
    "overrides": []
  },
  "expected": {
    "has_changes": true,
    "edit_types": ["Delete", "Insert"],
    "finding_codes": [
      "diff_unreliable_region",
      "diff_unreliable_region"
    ]
  }
}
