{
  "name": "junos_heavy_reorder_keyed_stable",
  "dialect": "junos",
  "intended": "interfaces {\n    ge-0/0/0 {\n        description \"uplink-core-a\";\n        mtu 9216;\n        unit 0 {\n            family inet {\n                address 192.0.2.2/30;\n            }\n        }\n    }\n    ge-0/0/1 {\n        description \"server-lan\";\n        unit 0 {\n            family inet {\n                address 10.10.1.1/24;\n            }\n        }\n    }\n}\npolicy-options {\n    policy-statement EDGE-EXPORT {\n        term ALLOW-SUMMARY {\n            from {\n                route-filter 10.10.0.0/16 orlonger;\n            }\n            then accept;\n        }\n    }\n}\nset system host-name edge-1\nset system domain-name example.com\nset system time-zone UTC\nset system name-server 8.8.8.8\nset system name-server 1.1.1.1\nset system services ssh root-login deny\nset routing-options autonomous-system 65001\nset routing-options static route 0.0.0.0/0 next-hop 192.0.2.1\nset routing-options static route 10.0.0.0/8 next-hop 192.0.2.2\nset snmp community public authorization read-only\nset chassis alarm management-ethernet link-down ignore\nset class-of-service interfaces ge-0/0/0 scheduler-map SCHED\nset forwarding-options sampling input rate 1000\nset security policies default-policy deny-all\n",
  "actual": "interfaces {\n    ge-0/0/1 {\n        unit 0 {\n            family inet {\n                address 10.10.1.1/24;\n            }\n        }\n        description \"server-lan\";\n    }\n    ge-0/0/0 {\n        mtu 9216;\n        description \"uplink-core-a\";\n        unit 0 {\n            family inet {\n                address 192.0.2.2/30;\n            }\n        }\n    }\n}\npolicy-options {\n    policy-statement EDGE-EXPORT {\n        term ALLOW-SUMMARY {\n            then accept;\n            from {\n                route-filter 10.10.0.0/16 orlonger;\n            }\n        }\n    }\n}\nset routing-options static route 10.0.0.0/8 next-hop 192.0.2.2\nset system time-zone UTC\nset security policies default-policy deny-all\nset system name-server 1.1.1.1\nset chassis alarm management-ethernet link-down ignore\nset system domain-name example.com\nset routing-options autonomous-system 65001\nset forwarding-options sampling input rate 1000\nset system host-name edge-1\nset snmp community public authorization read-only\nset system services ssh root-login deny\nset class-of-service interfaces ge-0/0/0 scheduler-map SCHED\nset routing-options static route 0.0.0.0/0 next-hop 192.0.2.1\nset system name-server 8.8.8.8\n",
  "normalization_steps": [],
  "order_policy": {
    "default": "keyed-stable",
    "overrides": []
  },
  "expected": {
    "has_changes": false,
    "edit_types": [],
    "finding_codes": []
  }
}
