{
  "name": "reorder_keyed_stable",
  "intended": "interface Ethernet1\n  description uplink\n  mtu 9000\n  storm-control broadcast level 1.00\n",
  "actual": "interface Ethernet1\n  storm-control broadcast level 1.00\n  mtu 9000\n  description uplink\n",
  "normalization_steps": [],
  "order_policy": {
    "default": "keyed-stable",
    "overrides": []
  },
  "expected": {
    "has_changes": false,
    "edit_types": [],
    "finding_codes": []
  }
}
